Sprout Point, Lycoming, Steel, A, 1938, Not Standing, Moved from Holmes Hurst ReMoved1985, 
Spruce Mtn, Mifflin?, Tree, U/A, Not Standing, Used circa 1917, 
St Boniface, Westmoreland, Steel, A, 1935, Not Standing, Moved from Kecksburg, Removed 1974, 
St Lawrence, Cambria, Steel, A, 1921, Not Standing, Removed 1978, 
St Petersburg, Clarion, Steel, A, 1937, Not Standing, Removed 1982, AKA Kahle, 
Staley's Knob, Adams, 1-Tree, 2-Wood, 1904, Not Standing, Tree replaced 1912, Replaced 1922 moved 1934, renamed Buck Ridge, 
State Capitol, Dauphin, Building, U/A, Standing, Used 1920s, no longer used, 
Stone Mtn, Huntingdon, Tree, 1907, Not Standing, Still Used circa 1917, 
Stony Mtn, Dauphin, Steel, B-K, 1923, Not Standing, Replaced 1967, 
Stony Mtn, Dauphin, Steel, C, 1967, Standing, State, 
Stony Point, Union, Bald, U/A, Not Standing, Used circa 1917, 
Stony Point, Carbon, Steel, A, 1921, Standing, State, 
Strattenville, Clarion, Steel, A, 1928, Not Standing, Removed 1964, 
Sugar Loaf, Fayette, Steel, A, 1921, Not Standing, Removed,date unknown, 
Summit Colliery, Carbon, Steel?, 1924, Not Standing, Built by coal co, 
Tamarack, Clinton, Bald, U/A, Not Standing, Used circa 1917, 
Tamarack, Clinton, Steel, A, 1920, Standing, State, 
Tannery Hill, Tioga, Tree, 1914, Not Standing, Still Used circa 1917, 
Tark Hill, Lackawanna, Steel?, 1951, Not Standing, Replaced 1960, 
The Knob, Union, Bald, U/A, Not Standing, Used circa 1917, 
The Knob, Clinton, Wood, 1910, Not Standing, Still Used circa 1917, 
The Knobs, Clearfield, Steel, A, 1921, Standing, State, 
Thick Mtn, Mifflin?, Tree, U/A, Not Standing, Used circa 1917, 
Thickhead, Centre, Tree, 1915, Not Standing, Still Used circa 1917, 
Three Runs, Cameron, Steel, B-K, 1923, Not Standing, Removed 1979, 
Three Runs, Clearfield, Wood, U/A, Not Standing, Early 1900s, Used 15 years, 
Tionesta, Forest, Steel, A, 1928, Standing, State, 
Treaster, Centre, Tree, 1913, Not Standing, Still Used circa 1917, 
Treaster High Top, Mifflin, Tree, U/A, Not Standing, Used circa 1917, 
tree Top, Pike, U/A, U/A, Not Standing, Used Early 1900s, 
Trevorton, NorthumberLand, Steel, I-S, 1934, Not Standing, Removed before 2006, 
Tri County, Blair, Steel, A, 1928, Not Standing, Removed 1976, 
Trout Run, Clinton, Wood, 1917, Not Standing, U/A, 
Tunnel Hill, U/A, U/A, 1915, Not Standing, In Poconos, 
Tuscarora, Fulton, Steel, A, 1921, Not Standing, Removed 1978, 
Tussey Mtn, Huntingdon, Steel, A, 1933, Not Standing, Removed 1977, 
Tyrone, Huntingdon, Steel, A, 1933, Not Standing, Removed 1972, 
Upper Beam Field, Westmoreland, Bald, U/A, Not Standing, Used circa 1917, 
USGS, Tioga, Wood, 1899, Not Standing, Replaced1921, 
Victory, Venango, Steel, A, 1925, Not Standing, Removed 1959, 
Virginia Rocks, Franklin, Bald, U/A, Not Standing, Used circa 1917, 
Wagner, Juniata, Steel, B-K, 1923, Not Standing, Removed, date unknown, 
Walters Run, Clinton, Tree, 1913, Not Standing, Still Used circa 1917, 
Washington Springs, Fayette, Steel, A, 1928, Standing, Private, 
Waterville, Lycoming, Steel, I-S, 1933, Not Standing, Removed 1975, 
Weiss Hollow, Elk, Wood, U/A, Not Standing, Used Early 1900s, 
West Branch, Centre, Wood, 1914, Not Standing, Still Used circa 1917, 
West Fall, Pike, Steel, B-K?, 1923, Not Standing, Replaced about 1935, 
West Hill, Tioga, 1-Tree, 2-Wood, >1913, Not Standing, Tree Replaced 1915, Still Used circa 1917, 
West Pike, Potter, Steel, A, 1920, Not Standing, Removed about 1985, 
Wheeler, Warren, Steel, B-K, 1923, Standing, USFS, 
Whetham, Clinton, Steel, B-K, 1923, Not Standing, Removed 1990, 
Whipple, Huntingdon, Wood, 1916, Not Standing, U/A, 
White Deer Mtn, Union, Tree, 1913, Not Standing, Still Used circa 1917, 
White Rocks, Franklin, Wood, 1914, Not Standing, Removed 1932, 
Whittaker, Pike, Wood, 1914, Not Standing, Still Used circa 1917, 
Whittimore, Cameron, Steel, A, 1921, Standing, State, 
Wildwood, Elk, Steel, B-K, 1922, Not Standing, Removed 1976, 
Williamsport Rd, Lycoming, Bald, U/A, Not Standing, Used circa 1917, 
Wills, Wyoming, Steel, A, U/A, Standing, Private, 
Winslow, Elk, Steel, B-K, 1925, Not Standing, Removed 2001, 
Work Hill, Fayette, Cabin, 1924, Not Standing, removed 1924, 
Yorkville, Schuylkill, Steel, A, 1941, Not Standing, Removed 1973, 
Zimmerman, Forest, Steel, A, U/A, Not Standing, USFS, Removed, date unknown, 
Zook, Huntingdon, Tree, 1916, Not Standing, U/A, 
, , , , , , 
Totals: Total standing active - 27 Total standing inactive - 36 Total no longer standing - 380, 
Notes: Fire Tower research by Merl Waltz, September 2006 with assistance from many but special thanks to Steve Cummings and Robert Spear. Corrections & comments to merlwaltz@innernet.net or paforestfiremuseum.org, Key: U/A - Unavailable at this time Make abbreviations: Am T & E= American Tube & Electric A= Aermotor B= Baker Manufacturing Co B-K= Blaw-Knox C= Caldwell I-S= International-Stacey M-M= McClintic-Marshall P=Platform T=Tank TS= Tubular Steel Comments abbreviations: AFPA= Anthracite Forest Protective Association PFPA= Pocono Forest Protective Association USFS= United States Forest Service, 
